verify that both the functions are available .,replica . run ( __str__ + replicated db name ) . run ( __str__ + replicated db name ) . verify result ( tuple . last replication id ) . run ( __str__ + replicated db name + __str__ ) . verify results ( new string [ ] { replicated db name + __str__ + func name1 @$ replicated db name + __str__ + func name2 } ) ;
wait for other side to close down .,if ( separate server thread ) { if ( server thread != null ) { server thread . join ( ) ; } } else { if ( client thread != null ) { client thread . join ( ) ; } }
workaround to set default for old schema,if ( namespace == namespace . web_1_1 || namespace == namespace . web_1_0 ) { if ( ! ssl . has defined ( webssl definition . key_alias . get name ( ) ) ) { ssl . get ( webssl definition . key_alias . get name ( ) ) . set ( __str__ ) ; } }
query on single short variable @$ should result in 2 matches,execution query query = runtime service . create execution query ( ) . variable value equals ( __str__ @$ short var ) ; list < execution > executions = query . list ( ) ; assert not null ( executions ) ; assert equals ( __num__ @$ executions . size ( ) ) ;
the coinbase in the genesis block is not spendable,list < transaction > genesis transactions = new linked list < > ( ) ; stored undoable block stored genesis = new stored undoable block ( params . get genesis block ( ) . get hash ( ) @$ genesis transactions ) ; put ( stored genesis header @$ stored genesis ) ; set chain head ( stored genesis header ) ; set verified chain head ( stored genesis header ) ; this . params = params ;
so : first find possible custom instances,if ( _list type == null ) { _list deserializer = _clear if std impl ( _find custom deser ( ctxt @$ tf . construct collection type ( list . class @$ ob type ) ) ) ; } else { _list deserializer = _find custom deser ( ctxt @$ _list type ) ; }
set the shell size @$ based upon previous time ...,set size ( ) ; get data ( ) ; input . set changed ( backup changed ) ; shell . open ( ) ; while ( ! shell . is disposed ( ) ) { if ( ! display . read and dispatch ( ) ) { display . sleep ( ) ; } } return stepname ;
read the apply numeric classifiers from disk,boolean disk apply numeric classifiers = ois . read boolean ( ) ; if ( props . get property ( __str__ ) != null ) { this . apply numeric classifiers = boolean . parse boolean ( props . get property ( __str__ ) ) ; } else { this . apply numeric classifiers = disk apply numeric classifiers ; } this . ner language = ner_language_default ;
make sure the class path is complete,file cfile = new file ( class path ) ; string absolute path = cfile . get absolute path ( ) ; if ( ! class path . equals ( absolute path ) ) { class path = absolute path ; } if ( ! class path . ends with ( file . separator ) ) { class path = class path + file . separator ; }
sticky bit omitted on sb omitted test dir should behave like reset,hdfs . set permission ( sb omitted test dir @$ new fs permission ( ( short ) __num__ ) ) ; log . info ( __str__ @$ sb omitted test dir . get name ( ) @$ hdfs . get file status ( sb omitted test dir ) . get permission ( ) ) ; assert false ( hdfs . get file status ( sb omitted test dir ) . get permission ( ) . get sticky bit ( ) ) ;
audio record start begin signal custom code block,try { if ( m audio recorder != null ) { m audio recorder . start recording ( ) ; } else { log . w ( tag @$ __str__ ) ; } } catch ( illegal state exception e ) { post listener . on error ( video capture error . encoder_error @$ __str__ @$ e ) ; return ; }
wait until the server has finished attempting to close the cq,try { assert that ( finish . await ( __num__ @$ seconds ) ) . described as ( __str__ ) . is true ( ) ; } catch ( interrupted exception e ) { e . print stack trace ( ) ; thread . current thread ( ) . interrupt ( ) ; }
only the succeed reconstructions are recorded .,final data node metrics metrics = get datanode ( ) . get metrics ( ) ; metrics . increc reconstruction read time ( read end - start ) ; metrics . increc reconstruction decoding time ( decode end - read end ) ; metrics . increc reconstruction write time ( write end - decode end ) ; update position in block ( to reconstruct len ) ; clear buffers ( ) ;
throws null pointer exception if key null,final int hash = this . entry creator . key hash code ( key @$ this . compare values ) ; return segment for ( hash ) . remove ( key @$ hash @$ no_object_token @$ null @$ null @$ null ) ;
in unbuffered mode only show message wrapper if there is an error,if ( ! is buffered ( ) ) { set message and buttons wrapper visible ( error message != null ) ; } if ( state == state . active || state == state . saving ) { for ( column < ? @$ t > c : grid . get columns ( ) ) { grid . get editor ( ) . set editor column error ( c @$ error columns . contains ( c ) ) ; } }
set new configuration with queue b removed .,cs conf = new capacity scheduler configuration ( conf ) ; setup queue configuration onlya ( cs conf ) ; string diags = __str__ + __str__ ; verify app recovery with wrong queue config ( cs conf @$ app2 @$ diags @$ mem store @$ state ) ;
synchronization is harmless for local thread engine @$ necessary for shared engine,synchronized ( engine ) { engine . put ( __str__ @$ curi ) ; engine . put ( __str__ @$ app ctx ) ; try { engine . eval ( __str__ ) ; } catch ( script exception e ) { logger . log ( level . warning @$ e . get message ( ) @$ e ) ; } finally { engine . put ( __str__ @$ null ) ; engine . put ( __str__ @$ null ) ; } }
leave msb bit off @$ so use 63 bits,assert that ( uleb128 . size ( ( __num__ << __num__ ) - __num__ ) @$ equal to ( __num__ ) ) ; assert that ( uleb128 . size ( long . max_value ) @$ equal to ( __num__ ) ) ; assert that ( uleb128 . size ( long . min_value ) @$ equal to ( __num__ ) ) ; assert that ( uleb128 . size ( - __num__ ) @$ equal to ( __num__ ) ) ;
if the button is pressed and the mouse is over it,if ( button model . is pressed ( ) && button model . is armed ( ) ) { internal background color = metal look and feel . get primary control shadow ( ) ; ul light highlight color = internal background color ; main item color = dark highlight color ; }
what 's the last occurance : decimal point !,int idx_dot = field . index of ( __str__ ) ; int idx_com = field . index of ( __str__ ) ; if ( idx_dot > idx_com ) { dfs . set decimal separator ( __str__ ) ; decimal = __str__ ; dfs . set grouping separator ( __str__ ) ; grouping = __str__ ; } else { dfs . set decimal separator ( __str__ ) ; decimal = __str__ ; dfs . set grouping separator ( __str__ ) ; grouping = __str__ ; }
create remote file in local staging dir to simulate,path staging dir = get staging dir ( ) ; test commons . get file utils ( ) . create file in dir ( staging dir @$ remote uri1 ) ; file remote dir1 = test commons . get file utils ( ) . create directory ( staging dir @$ remote uri2 ) ; test commons . get file utils ( ) . create file in dir ( remote dir1 @$ __str__ ) ;
cast the message as a text message .,try { javax . jms . text message text message = ( javax . jms . text message ) a message ; try { string string = text message . get text ( ) ; system . out . println ( string ) ; } catch ( javax . jms . jms exception jmse ) { jmse . print stack trace ( ) ; } } catch ( java . lang . runtime exception rte ) { rte . print stack trace ( ) ; }
display it in the text view .,int size = data == null ? __num__ : data . length ; string builder sb = new string builder ( ) ; sb . append ( good ? __str__ : __str__ ) ; sb . append ( __str__ ) . append ( size ) . append ( __str__ ) ; if ( good && reports != null ) { display log report ( sb @$ reports ) ; m report text . set text ( sb . to string ( ) ) ; }
setup all the redirect handles @$ including the return file type,err file = paths . get ( base . to string ( ) @$ uuid + __str__ ) ; out file = paths . get ( base . to string ( ) @$ uuid + __str__ ) ; result file = paths . get ( base . to string ( ) @$ uuid + __str__ ) ;
run once to get to a startup state,configure ( __num__ @$ __num__ @$ __num__ ) ; voltdb . ignore crash = true ; thread dutthread = new thread ( ) { @ override public void run ( ) { try { m_dut . accept promotion ( ) ; } catch ( exception e ) { } } } ; dutthread . start ( ) ;
remove line continuation characters from string literals,if ( js token . kind == ecmascript5 parser constants . string_literal || js token . kind == ecmascript5 parser constants . unterminated_string_literal ) { return token . get image ( ) . replace all ( __str__ @$ __str__ ) ; } return token . get image ( ) ;
so wait around here a while .,waiter . wait for ( am . get configuration ( ) @$ __num__ @$ ( ) -> am . get region states ( ) . get region state node ( region info ) != null ) ; region state node region node = am . get region states ( ) . get region state node ( region info ) ;
two lines using platform 's line separator,list < string > expected = arrays . as list ( __str__ @$ __str__ ) ; files . write ( tmpfile @$ expected @$ us_ascii ) ; assert true ( files . size ( tmpfile ) > __num__ @$ __str__ ) ; lines = files . read all lines ( tmpfile @$ us_ascii ) ; assert true ( lines . equals ( expected ) @$ __str__ ) ;
look for xerces 1 and xerces 2 parsers separately,try { final string xerces2_version_class = __str__ ; class clazz = object factory . find provider class ( xerces2_version_class @$ object factory . find class loader ( ) @$ true ) ; field f = clazz . get field ( __str__ ) ; string parser version = ( string ) f . get ( null ) ; h . put ( version + __str__ @$ parser version ) ; } catch ( exception e ) { h . put ( version + __str__ @$ class_notpresent ) ; }
can this number simply be added to the next interval ?,if ( number == ( entry after . get start ( ) - __num__ ) ) { if ( ! appended ) { entry after . set start ( number ) ; } else { entry after . set start ( entry before . get start ( ) ) ; list . remove ( prev entry pos ) ; if ( window start index > prev entry pos ) window start index -- ; } prepended = true ; }
create a separate subprocess just for this argument .,subprocess builder subprocess builder = new subprocess builder ( windows subprocess factory . instance ) ; subprocess builder . set working directory ( new file ( __str__ ) ) ; subprocess builder . set argv ( print arg exe @$ arg . original ) ; process = subprocess builder . start ( ) ; process . wait for ( ) ; assert that ( process . exit value ( ) ) . is equal to ( __num__ ) ;
anonymous classes are private @$ they should be eliminated elsewhere,return modifier . is public ( t . get modifiers ( ) ) && ( t . is interface ( ) || t . is enum ( ) || modifier . is static ( t . get modifiers ( ) ) ) ;
try to delete the data type @$ should error out,try { meta store . delete element type ( namespace @$ element type ) ; fail ( __str__ ) ; } catch ( meta store dependencies exists exception e ) { list < string > dependencies = e . get dependencies ( ) ; assert not null ( dependencies ) ; assert equals ( __num__ @$ dependencies . size ( ) ) ; assert equals ( customer dimension . get id ( ) @$ dependencies . get ( __num__ ) ) ; }
alas @$ we have to pull the recycler directly here ...,segmented string writer sw = new segmented string writer ( _generator factory . _get buffer recycler ( ) ) ; default serializer provider ctxt = _serializer provider ( ) ; try { _config and write value ( ctxt @$ _generator factory . create generator ( ctxt @$ sw ) @$ value ) ; } catch ( json processing exception e ) { throw e ; } catch ( io exception e ) { throw json mapping exception . from unexpectedioe ( e ) ; }
modern is simpler : do n't care about anything but a grave,if ( ! full ) { for ( int i = __num__ ; i < decomp . length ( ) ; ++ i ) { char c = decomp . char at ( i ) ; if ( c == __str__ || c == __str__ || c == __str__ || c == __str__ || c == __str__ || c == __str__ ) return false ; } return true ; }
right node is elliminated and all entries stored in left node,if ( new left key count <= max key count ) { move keys left ( left node @$ right node @$ right key count ) ; node mgr . delete node ( right node ) ; return delete child ( right key ) ; }
draw the other dimensions around the fact ...,if ( ! table list . is empty ( ) ) { list < table point > dim points = get circle points ( center @$ center . x - max width / __num__ - __num__ @$ center . y - __num__ @$ table list ) ; points . add all ( dim points ) ; }
wait until the last async operation is finished .,last future . get ( ) ; m cache update service = shortcut info compat saver impl . create executor service ( ) ; m disk io service = shortcut info compat saver impl . create executor service ( ) ; m shortcut info saver = new shortcut info compat saver impl ( m context @$ m cache update service @$ m disk io service ) ;
check if at @$ or could be @$ head,for ( ; ; ) { node h = head ; if ( h == pred || h == s || h == null ) return ; if ( ! h . is matched ( ) ) break ; node hn = h . next ; if ( hn == null ) return ; if ( hn != h && cas head ( h @$ hn ) ) h . forget next ( ) ; }
try to connect to a relay on localhost,config builder . get runtime ( ) . get relay ( __str__ ) . set host ( __str__ ) ; config builder . get runtime ( ) . get relay ( __str__ ) . set port ( __num__ ) ; config builder . get runtime ( ) . get relay ( __str__ ) . set sources ( person_source ) ;
try to remove the workspace owner from the members list,workspace share . wait invite member dialog closed ( ) ; workspace share . wait member name in share list ( system admin name ) ; workspace share . click on remove member button ( system admin name ) ; workspace details . click on delete button in dialog window ( ) ; dashboard . wait notification message ( __str__ ) ; dashboard . wait notification is closed ( ) ;
check that the roll happened correctly for the given data,long expected files = total events / roll count ; if ( total events % roll count > __num__ ) expected files ++ ; assert . assert equals ( __str__ + lists . new array list ( f list ) @$ expected files @$ f list . length ) ;
use local deploy mode and data format,conf . set ( angel conf . angel_deploy_mode @$ __str__ ) ; conf . set ( angelml conf . ml_data_input_format ( ) @$ string . value of ( data type ) ) ; conf . set ( angelml conf . ml_model_type ( ) @$ angelml conf . default_ml_model_type ( ) ) ;
replicate and verify if only 2 tables are replicated to target .,string [ ] replicated tables = new string [ ] { __str__ @$ __str__ } ; string [ ] bootstrap tables = new string [ ] { } ; last repl id = replicate and verify ( repl policy @$ null @$ last repl id @$ null @$ null @$ bootstrap tables @$ replicated tables ) ;
caution : this removes the old list of relation mentions !,for ( relation mention r : relations ) { if ( ! r . get type ( ) . equals ( relation mention . unrelated ) ) { logger . fine ( __str__ + r ) ; } } sentence . set ( machine reading annotations . relation mentions annotation . class @$ relations ) ;
creating colocated region data store node on the vm 0 .,vm0 . invoke ( pr queryd unit helper . get cache serializable runnable for local region creation ( colo name @$ new portfolio . class ) ) ; portfolio [ ] portfolio = create portfolios and positions ( cnt dest ) ; new portfolio [ ] new portfolio = create new portfolios and positions ( cnt dest ) ;
compute the number of unit that needs to be borrowed .,big decimal borrow = buf [ i ] . abs ( ) . divide ( factors [ i - __num__ ] @$ big decimal . round_up ) ; if ( buf [ i ] . signum ( ) > __num__ ) { borrow = borrow . negate ( ) ; }
count the trailing zeros in the magnitude,if ( signum < __num__ ) { int mag trailing zero count = __num__ @$ j ; for ( j = mag . length - __num__ ; mag [ j ] == __num__ ; j -- ) mag trailing zero count += __num__ ; mag trailing zero count += integer . number of trailing zeros ( mag [ j ] ) ; bc += mag trailing zero count - __num__ ; }
delete first char of element and returns number,int [ ] number = collection . stream ( ) . map to int ( ( s ) -> integer . parse int ( s . substring ( __num__ ) ) ) . to array ( ) ; system . out . println ( __str__ + arrays . to string ( number ) ) ;
read the standard length atom header .,if ( atom header bytes read == __num__ ) { if ( ! input . read fully ( atom header . data @$ __num__ @$ atom . header_size @$ true ) ) { return false ; } atom header bytes read = atom . header_size ; atom header . set position ( __num__ ) ; atom size = atom header . read unsigned int ( ) ; atom type = atom header . read int ( ) ; }
testing that the return by skip is valid,input stream check input = support_ resources . get stream ( __str__ ) ; checked input stream check in = new checked input stream ( check input @$ new crc32 ( ) ) ; check in . read ( ) ; check in . close ( ) ; try { check in . read ( ) ; fail ( __str__ ) ; } catch ( io exception ee ) { }
verify jar with second key in strict mode,analyzer = process tools . execute command ( jarsigner @$ __str__ @$ __str__ @$ __str__ @$ keystore @$ __str__ @$ password @$ __str__ @$ password @$ updated_signed_jarfile @$ second_key_alias ) ; int expected exit code = has_expired_cert_exit_code + bad_extended_key_usage_exit_code + has_unsigned_entry_exit_code + not_signed_by_alias_exit_code ; check verifying ( analyzer @$ expected exit code @$ bad_extended_key_usage_verifying_warning @$ has_expired_cert_verifying_warning @$ has_unsigned_entry_verifying_warning @$ not_signed_by_alias_verifying_warning ) ;
send any committed text to the text component,if ( committed character count > __num__ ) { input method context . dispatch committed text ( ( ( component ) event . get source ( ) ) @$ text @$ committed character count ) ; if ( is composition area visible ( ) ) { composition area . update window location ( ) ; } }
ensure that all classes are properly loaded,test root node root node = new test root node ( default @$ new test repeating node ( ) ) ; call target target = runtime . create call target ( root node ) ; target . call ( __num__ ) ; root node = new test root node ( configured @$ new test repeating node ( ) ) ; target = runtime . create call target ( root node ) ; target . call ( __num__ ) ;
deletion is async : wait util they are no longer reported,final set < string > remaining = new hash set < > ( topics ) ; while ( ! remaining . is empty ( ) ) { final set < string > topic names = admin client . list topics ( ) . names ( ) . get ( ) ; remaining . retain all ( topic names ) ; }
singleton behaviour : create the cache instance if required .,if ( hive client cache == null ) { synchronized ( i meta store client . class ) { if ( hive client cache == null ) { hive client cache = new hive client cache ( hive conf ) ; } } } try { return hive client cache . get ( hive conf ) ; } catch ( login exception e ) { throw new io exception ( __str__ @$ e ) ; }
using different key returns a different object,assert . assert not equals ( task broker . get shared resource at scope ( new test factory < gobblin scope types > ( ) @$ new test resource key ( __str__ ) @$ gobblin scope types . job ) @$ resource ) ;
ask user to report all bugs which are n't timeout errors,if ( ! timeout occured ( e2 ) ) { anki droid app . send exception report ( e2 @$ __str__ ) ; } data . success = false ; data . result = new object [ ] { __str__ } ; return data ;
if names are different in some way,bookmark contents = __str__ ; plate comment contents = __str__ ; if ( name analysis . num names ( ) == __num__ ) { plate comment contents = plate comment contents + __str__ ; bookmark contents = bookmark contents + __str__ ; } else { plate comment contents = plate comment contents + __str__ ; bookmark contents = bookmark contents + __str__ ; }
it is a directory so merge everything in the directories,for ( file status sub from : fs . list status ( from . get path ( ) ) ) { path sub to = new path ( to @$ sub from . get path ( ) . get name ( ) ) ; merge paths ( fs @$ sub from @$ sub to @$ context ) ; }
set the information of the injector .,string injector pid = registry . get plugin id ( step plugin type . class @$ im ) ; step meta injector step = new step meta ( injector pid @$ injector stepname @$ im ) ; trans meta . add step ( injector step ) ;
sort a two element list by swapping if necessary,if ( lo == hi - __num__ ) { if ( a [ lo ] > a [ hi ] ) { int t = a [ lo ] ; a [ lo ] = a [ hi ] ; a [ hi ] = t ; } return ; }
function to create a stream using a random boxed spliterator,function < function < splittable random @$ integer > @$ int stream > rbsf = sf -> stream support . stream ( new random boxed spliterator < > ( new splittable random ( ) @$ __num__ @$ size @$ sf ) @$ false ) . map to int ( i -> i ) ;
ip file is assigned to the first device,list < fpga device > devices = fpga resource handler . get fpga allocator ( ) . get allowed fpga ( ) ; fpga device device = devices . get ( __num__ ) ; assert equals ( __str__ @$ expected_hash @$ device . get aocx hash ( ) ) ;
if its input does not change at all between builds .,assert action executions ( new execution counting action factory ( ) { @ override public execution counting action create ( artifact input @$ artifact output @$ atomic integer execution counter ) { return unconditional execution ? new execution counting cache bypassing action ( input @$ output @$ execution counter ) : new execution counting action ( input @$ output @$ execution counter ) ; } } @$ change artifact . dont_change @$ callables . < void > returning ( null ) @$ expect action is . not_dirtied ) ;
add every relevant class to the ic attribute :,if ( ic refs . contains ( ic . this class ) || ic . outer class == this . this class ) { if ( verbose > __num__ ) utils . log . fine ( __str__ + ic ) ; impliedi cs . add ( ic ) ; }
condition 2 : graph is connected @$ ignoring isolated vertices,int s = non isolated vertex ( g ) ; breadth first paths bfs = new breadth first paths ( g @$ s ) ; for ( int v = __num__ ; v < g . v ( ) ; v ++ ) if ( g . degree ( v ) > __num__ && ! bfs . has path to ( v ) ) return false ; return true ;
gets the depth of the meta node in the oid tree,final int depth = handlers . get oid depth ( h ) ; for ( enumeration < snmp mib sub request > rqs = handlers . get sub requests ( h ) ; rqs . has more elements ( ) ; ) { meta . get ( rqs . next element ( ) @$ depth ) ; }
s 2 is asked to commit .,segment completion mgr . _seconds += __num__ ; params = new request . params ( ) . with instance id ( s2 ) . with offset ( s2 offset ) . with segment name ( segment name str ) ; response = segment completion mgr . segment consumed ( params ) ; assert . assert equals ( response . get status ( ) @$ segment completion protocol . controller response status . commit ) ;
saving the original value of the param @$ for restoration purposes,string old param = client . get config ( ) . get ( __str__ @$ __str__ ) ; string original path = client . addam env ( ) . get ( __str__ ) ; client . get config ( ) . set ( __str__ @$ __str__ ) ; string new path = client . addam env ( ) . get ( __str__ ) ; assert . assert equals ( original path + __str__ @$ new path ) ;
if a registered builder was n't found then use the default,media source builder builder = source type builder != null ? source type builder . builder : new default media source builder ( ) ; return builder . build ( context @$ uri @$ user agent @$ handler @$ transfer listener ) ;
extract and reconstruct query pattern with the required i ds,answer proto . concept map explainable = explanation req . get explainable ( ) ; pattern query pattern = graql . parse pattern ( explainable . get pattern ( ) ) ; explanation explanation = tx . explanation ( query pattern ) ; transaction . res response = response builder . transaction . explanation ( explanation ) ; on next response ( response ) ;
restore the corresponding record set for every input channel,final map < integer @$ array deque < serialization test type > > serialized records = new hash map < > ( ) ; for ( int i = __num__ ; i < number of channels ; i ++ ) { serialized records . put ( i @$ new array deque < > ( ) ) ; }
fallback to the label labeling us if it exists,if ( name == null ) { object o = get client property ( j label . labeled_by_property ) ; if ( o instanceof accessible ) { accessible context ac = ( ( accessible ) o ) . get accessible context ( ) ; if ( ac != null ) { name = ac . get accessible name ( ) ; } } } return name ;
get interacted view from x @$ y coordinate .,view child = m recycler view . find child view under ( e . getx ( ) @$ e . gety ( ) ) ; if ( child != null ) { get table view listener ( ) ; recycler view . view holder holder = m recycler view . get child view holder ( child ) ; get table view listener ( ) . on row header long pressed ( holder @$ holder . get adapter position ( ) ) ; }
block originally on a 1 @$ a 2 @$ b 1,list < datanode storage info > orig storages = get storages ( __num__ @$ __num__ @$ __num__ ) ; list < datanode descriptor > orig nodes = get nodes ( orig storages ) ; block info block info = add block on nodes ( test index @$ orig nodes ) ;
or the one from the super persistent class,component propagated mapper = identifier mapper ; if ( propagated mapper == null ) { if ( super mapped superclass != null ) { propagated mapper = super mapped superclass . get identifier mapper ( ) ; } if ( propagated mapper == null && super persistent class != null ) { propagated mapper = super persistent class . get identifier mapper ( ) ; } } return propagated mapper ;
major compaction for all region servers .,for ( h region server rs : rs list ) admin . major compact region server ( rs . get server name ( ) ) . get ( ) ; thread . sleep ( __num__ ) ; int count after major compaction = count store files in families ( regions @$ families ) ; assert equals ( __num__ @$ count after major compaction ) ;
