find the union of the icon and text rects,rectangle r = new rectangle ( ) ; r . set bounds ( text rect ) ; r = swing utilities . compute union ( icon rect . x @$ icon rect . y @$ icon rect . width @$ icon rect . height @$ r ) ;
will add q 1 as a query being executed,thread . sleep ( __num__ ) ; obj store . mark scheduled executions timed out ( __num__ ) ; try ( persistence manager pm = persistence manager provider . get persistence manager ( ) ) { m scheduled execution execution = pm . get object by id ( m scheduled execution . class @$ poll result . get execution id ( ) ) ; assert equals ( query state . timed_out @$ execution . get state ( ) ) ; }
first dvc should be the total row count indicator,final dim value count first dvc = iterator . next ( ) ; final long total rows = first dvc . num rows ; if ( ! __str__ . equals ( first dvc . dim ) || ! __str__ . equals ( first dvc . value ) ) { throw new illegal state exception ( __str__ ) ; }
create the initial file of old file len,final path p = new path ( __str__ + old file len + __str__ + flushed bytes1 + __str__ + flushed bytes2 ) ; log . info ( __str__ + p ) ; fs data output stream out = fs . create ( p @$ false @$ conf . get int ( common configuration keys . io_file_buffer_size_key @$ __num__ ) @$ replication @$ block_size ) ; out . write ( contents @$ __num__ @$ old file len ) ; out . close ( ) ;
keep the current item in the valid range,if ( m cur item == ii . position ) { new curr item = math . max ( __num__ @$ math . min ( m cur item @$ adapter count - __num__ ) ) ; need populate = true ; }
send first produce request with multiple messages .,future < record metadata > request1 = append to accumulator ( tp0 ) ; append to accumulator ( tp0 ) ; sender . run once ( ) ; string node id = client . requests ( ) . peek ( ) . destination ( ) ; node node = new node ( integer . value of ( node id ) @$ __str__ @$ __num__ ) ; assert equals ( __num__ @$ client . in flight request count ( ) ) ;
set up the drawer 's list view with items and click listener,m pane list . set adapter ( new array adapter < string > ( this @$ r . layout . left_menu_layout @$ m animal titles ) ) ; m pane list . set on item click listener ( new drawer item click listener ( ) ) ;
verify that finished processes are removed after refresh,proc42 . finish ( __num__ ) ; process tracker . explicit run one iteration ( ) ; process tracker . verify external process info ( __num__ @$ proc41b @$ create params ( __str__ ) ) ; process tracker . verify no process info ( __num__ ) ; assert equals ( __num__ @$ process tracker . processes info . size ( ) ) ;
prepare today header text color paint .,m today header text paint = new paint ( paint . anti_alias_flag ) ; m today header text paint . set text align ( paint . align . center ) ; m today header text paint . set text size ( m text size ) ; m today header text paint . set typeface ( typeface . default_bold ) ; m today header text paint . set color ( m today header text color ) ;
m settings should be created before build input method list locked,m settings = new input method settings ( m res @$ context . get content resolver ( ) @$ m method map @$ user id @$ ! m system ready ) ; update current profile ids ( ) ; additional subtype utils . load ( m additional subtype map @$ user id ) ; m switching controller = input method subtype switching controller . create instance locked ( m settings @$ context ) ;
object used to corrupt the cache .,date interval format dif = date interval format . get instance ( __str__ @$ u locale . english ) ; calendar from = calendar . get instance ( ) ; calendar to = calendar . get instance ( ) ; from . set ( __num__ @$ __num__ @$ __num__ ) ; to . set ( __num__ @$ __num__ @$ __num__ ) ;
add a note re supported date range,if ( date == null ) { if ( locale . equals ( japanese_imperial ) ) { throw new parse exception ( __str__ + locale + __str__ + __str__ + source + __str__ + parse pattern . pattern ( ) @$ __num__ ) ; } throw new parse exception ( __str__ + source + __str__ + parse pattern . pattern ( ) @$ __num__ ) ; }
not enough memory there @$ take less,if ( ! memory control . request ( buffersize + __num__ * __num__ * __num__ @$ true ) ) { long lessmem = math . min ( max write buffer / __num__ @$ memory control . available ( ) - ( __num__ * __num__ * __num__ ) / __num__ ) ; buffersize = math . max ( __num__ @$ ( int ) ( lessmem / recordsize ) ) * recordsize ; }
check if the comparison is supported for this type,if ( ! object inspector utils . compare supported ( valueoi ) ) { throw new udf argument exception ( __str__ + func_name + __str__ + __str__ + valueoi . get type name ( ) + __str__ + __str__ ) ; } result = new boolean writable ( false ) ; return primitive object inspector factory . writable boolean object inspector ;
slice is waiting ; handle it first,if ( first > __num__ ) { unread ( ) ; break ; } else { boolean comp = ( ch == __str__ ) ; boolean one letter = true ; ch = next ( ) ; if ( ch != __str__ ) unread ( ) ; else one letter = false ; return family ( one letter @$ comp ) ; }
return the last target class @$ if any .,while ( true ) { class optimization info info = class optimization info . get class optimization info ( clazz ) ; if ( info == null ) { return target class ; } clazz = info . get target class ( ) ; if ( clazz == null ) { return target class ; } target class = clazz ; }
use empty string as the key for absent namespace,if ( desc . get context type ( ) == xsd description . context_import || desc . from instance ( ) ) { string namespace = desc . get target namespace ( ) ; string ns = namespace == null ? xml symbols . empty_string : namespace ; location array templa = location pairs . get ( ns ) ; if ( templa != null ) loc = templa . get first location ( ) ; }
create working directory for this region server .,string dir = server working dir ( server type @$ rs port ) ; string conf str = generate config ( server type @$ rs port @$ dir ) ; log . debug ( __str__ + dir ) ; new file ( dir ) . mkdirs ( ) ; write string to file ( conf str @$ dir + __str__ ) ;
always read annotation written by marshal output stream .,object annotation = read location ( ) ; class loader default loader = skip default resolve class ? null : latest user defined loader ( ) ; string codebase = null ; if ( ! use codebase only && annotation instanceof string ) { codebase = ( string ) annotation ; } return rmi class loader . load proxy class ( codebase @$ interfaces @$ default loader ) ;
avoid trying to create accessibility node info for removed children,if ( vh != null && ! vh . is removed ( ) && ! m child helper . is hidden ( vh . item view ) ) { on initialize accessibility node info for item ( m recycler view . m recycler @$ m recycler view . m state @$ host @$ info ) ; }
clearing text to remove the predefined one in the template,title . clear text ( ) ; xslf text paragraph p = title . add new text paragraph ( ) ; xslf text run r1 = p . add new text run ( ) ; r1 . set text ( __str__ ) ; r1 . set font color ( new color ( __num__ @$ __num__ @$ __num__ ) ) ; r1 . set font size ( __num__ ) ;
user 1 checks the presence of user 2 in the room,presence = muc . get occupant presence ( room + __str__ ) ; assert null ( __str__ @$ presence ) ; presence = muc . get occupant presence ( room + __str__ ) ; assert not null ( __str__ @$ presence ) ; assert equals ( __str__ @$ room + __str__ @$ presence . get from ( ) ) ;
need to trim to avoid whitespace around the coordinates such as tabs,string [ ] coordinates = coordinates string . trim ( ) . split ( __str__ ) ; for ( string coordinate : coordinates ) { lat lng alts array . add ( convert to lat lng alt ( coordinate ) ) ; } return lat lng alts array ;
0 is passed as readpoint because the test bypasses store,this ( null @$ scan @$ scan info @$ columns != null ? columns . size ( ) : __num__ @$ __num__ @$ scan . get cache blocks ( ) @$ scan type . user_scan ) ; this . matcher = user scan query matcher . create ( scan @$ scan info @$ columns @$ oldest unexpiredts @$ now @$ null ) ; seek all scanner ( scan info @$ scanners ) ;
add one to one 's complement to generate two 's complement,for ( int i = result . length - __num__ ; i >= __num__ ; i -- ) { result [ i ] = ( int ) ( ( result [ i ] & long_mask ) + __num__ ) ; if ( result [ i ] != __num__ ) break ; } return result ;
does it matches the bom artifact name,return dependencies . stream ( ) . filter ( dependency -> __str__ . equals ( dependency . get scope ( ) ) ) . filter ( dependency -> __str__ . equals ( dependency . get type ( ) ) ) . any match ( dependency -> dependency . get artifact id ( ) . equals ( mojo utils . template_property_quarkus_platform_artifact_id_value ) && dependency . get group id ( ) . equals ( mojo utils . template_property_quarkus_platform_group_id_value ) ) ;
if not @$ add an extra trailing field !,if ( pos + len < maxsize ) { text file input field field = new text file input field ( __str__ + dummynr @$ pos + len @$ maxsize - pos - len ) ; field . set ignored ( true ) ; fields . add ( field ) ; }
search through the running processes for a matching cmdline and kill it,string command = string . format ( __str__ + __str__ @$ process name ) ; try { execute command with error checking ( string . format ( __str__ @$ package name @$ command ) ) ; event bus . post ( console event . warning ( __str__ + process name ) ) ; } catch ( adb helper . command failed exception e ) { event bus . post ( console event . warning ( __str__ + __str__ @$ process name ) ) ; }
test group by column not in display columns,try { client . call procedure ( __str__ @$ __str__ + tb + __str__ ) ; fail ( ) ; } catch ( proc call exception ex ) { assert true ( ex . get message ( ) . contains ( __str__ ) ) ; }
retrieve key @$ default value and error text,string [ ] array = contents . split ( __str__ @$ __num__ ) ; array [ __num__ ] = array [ __num__ ] . trim ( ) ; if ( __str__ . equals ( array [ __num__ ] ) ) { return null ; }
assert we 're no longer run as :,assert false ( subject . is run as ( ) ) ; assert equals ( __str__ @$ subject . get principal ( ) ) ; assert true ( subject . has role ( __str__ ) ) ; assert false ( subject . has role ( __str__ ) ) ; assert false ( subject . has role ( __str__ ) ) ; assert null ( subject . get previous principals ( ) ) ;
at least one number and designator must be seen after p,boolean designator = false ; int end date = index of ( str @$ start @$ len @$ __str__ ) ; if ( end date == - __num__ ) { end date = len ; } else if ( duration type == yearmonthduration_type ) { throw new schema date time exception ( ) ; }
verify that there are no warning or error in vm output,command line option test . verify samejvm startup ( null @$ new string [ ] { rtm generic command line option test . rtm_instr_error @$ unrecongnized option } @$ exit code . ok @$ command line option test . unlock_experimental_vm_options @$ __str__ ) ; command line option test . verify samejvm startup ( null @$ new string [ ] { rtm generic command line option test . rtm_instr_error @$ unrecongnized option } @$ exit code . ok @$ command line option test . unlock_experimental_vm_options @$ __str__ ) ;
mock interrupt exception when peek lock only once,mockito . do throw ( new zk peek lock interrupt exception ( __str__ ) ) . do call real method ( ) . when ( spy ) . peek lock ( mockito . any string ( ) ) ; try { spy . lock ( path ) ; fail ( __str__ ) ; } catch ( exception e ) { assert true ( e instanceof zk peek lock interrupt exception ) ; }
now determine the small table results .,int first small table output column ; first small table output column = ( order [ __num__ ] == pos big table ? big table retain size : __num__ ) ; int small table output count = __num__ ; next output column = first small table output column ;
copy all basic code points to the output,int b = __num__ ; for ( int i = __num__ ; i < input . length ( ) ; i ++ ) { final char c = input . char at ( i ) ; if ( is basic ( c ) ) { output . append ( c ) ; b ++ ; } }
throw the packet away and silently continue,if ( ( ! connected address . equals ( peek address ) ) || ( connected port != peek port ) ) { datagram packet tmp = new datagram packet ( new byte [ __num__ ] @$ __num__ ) ; get impl ( ) . receive ( tmp ) ; } else { stop = true ; }
verify that this container is properly tracked,assert not null ( get process tree info ( get container id ( __num__ ) ) ) ; assert equals ( __num__ @$ get process tree info ( get container id ( __num__ ) ) . get pmem limit ( ) ) ; assert equals ( __num__ @$ get process tree info ( get container id ( __num__ ) ) . get vmem limit ( ) ) ;
create the problem set and cfd from files,ps = null ; cfd = null ; try { ps = new problem set ( prob set path ) ; cfd = new cumulative feature driver ( cfd path ) ; } catch ( exception e ) { logger . logln ( __str__ @$ log out . stderr ) ; e . print stack trace ( ) ; }
then close the reader gracefully so that the long.max watermark is emitted,synchronized ( tester . get checkpoint lock ( ) ) { tester . close ( ) ; } for ( org . apache . hadoop . fs . path file : files created ) { hdfs . delete ( file @$ false ) ; }
add the package name of the class for better accuracy .,if ( field class . get class type ( ) . get descriptor ( ) . contains ( __str__ ) ) { resource names . add ( field class . get package name ( ) + __str__ + field name . get string ( ) ) ; }
no overlap @$ just move the indexes to their new positions,if ( new start < start ) { m_map_ [ start > > > shift_ ] = new start ; for ( i = data_block_length ; i > __num__ ; -- i ) { m_data_ [ new start ++ ] = m_data_ [ start ++ ] ; } } else { m_map_ [ start > > > shift_ ] = start ; new start += data_block_length ; start = new start ; }
the setting of servers is done by a call to discovery service,list < server > servers = new array list < server > ( ) ; for ( string svc : is alive map . key set ( ) ) { servers . add ( new server ( svc ) ) ; } lb . add servers ( servers ) ;
reorder in fetch session @$ and update log start offset,if ( updated percentage != __num__ && counter % ( __num__ / updated percentage ) == __num__ ) { fetches . remove ( topic partition ) ; fetches . put ( topic partition @$ new fetch request . partition data ( __num__ @$ __num__ @$ __num__ @$ optional . empty ( ) ) ) ; }
invoking via reflection to avoid a strong dependency on jdk 9,try { method get pid = process . class . get method ( __str__ ) ; return ( long ) get pid . invoke ( process ) ; } catch ( exception e ) { log . warn ( e @$ __str__ ) ; }
checkstyle : stop magic number name check,if ( get exponent ( ) == all_one_exponent ) { if ( get bit ( __num__ @$ get fraction ( ) ) ) { if ( get bit ( __num__ @$ get fraction ( ) ) ) { return true ; } } else { return true ; } }
roll time ahead to be sure timer is due to fire,calendar tomorrow = calendar . get instance ( ) ; tomorrow . add ( calendar . day_of_year @$ __num__ ) ; process engine configuration . get clock ( ) . set current time ( tomorrow . get time ( ) ) ;
always require an ack to prevent misordering of messages,internal distributed system system = this . advisee . get system ( ) ; processor = new update attributes reply processor ( system @$ recipients ) ; update attributes message message = get update attributes message ( processor @$ recipients ) ; mgr . put outgoing ( message ) ; this . processor = processor ;
can launch the 5 th attempt successfully,rm2 . wait for state ( app1 . get application id ( ) @$ rm app state . accepted ) ; mockam am5 = rm2 . wait for newam to launch and register ( app1 . get application id ( ) @$ __num__ @$ nm1 ) ; clock . reset ( ) ; rm2 . wait for state ( am5 . get application attempt id ( ) @$ rm app attempt state . running ) ;
simulate the case the same key is built again inside the extension,property key fake extension key = new property key . builder ( fake key name ) . build ( ) ; assert equals ( __str__ @$ m configuration . get ( fake extension key ) ) ; assert true ( property key . from string ( fake key name ) . is built in ( ) ) ;
make sure all cipher suites names are expected,set remaining cipher suites = new hash set < string > ( expected ) ; set unknown cipher suites = new hash set < string > ( ) ; for ( string cipher suite : cipher suites ) { boolean removed = remaining cipher suites . remove ( cipher suite ) ; if ( ! removed ) { unknown cipher suites . add ( cipher suite ) ; } } assert equals ( __str__ @$ collections . empty_set @$ unknown cipher suites ) ; return remaining cipher suites ;
create a module the binds string.class and char sequence.class,module module = new abstract module ( ) { @ override protected void configure ( ) { bind ( string . class ) . to instance ( __str__ ) ; bind ( char sequence . class ) . to instance ( __str__ ) ; } } ;
skip the edge through which we came,for ( job edge e : v . get inputs ( ) ) { if ( e == edge ) { continue ; } intermediate data set source = e . get source ( ) ; if ( remaining . contains ( source . get producer ( ) ) ) { has new predecessors = true ; break ; } }
the indices are converted to little endian order,byte [ ] indices = new byte [ elements ] ; byte [ ] vx = memory state . get big integer ( index varnode @$ false ) . to byte array ( ) ; for ( int j = __num__ ; j < vx . length && j < elements ; j ++ ) indices [ j ] = vx [ vx . length - j - __num__ ] ;
validate that change of content is reflected in the other linked files,append to file ( x1_one @$ str3 ) ; assert true ( fetch file contents ( x1_one ) . equals ( str1 + str3 ) ) ; assert true ( fetch file contents ( x11_one ) . equals ( str1 + str3 ) ) ; assert true ( fetch file contents ( x1 ) . equals ( str1 + str3 ) ) ;
found a control sequence @$ discard it and revert to normal state,if ( ( b >= __str__ && b <= __str__ ) || ( b >= __str__ && b <= __str__ ) ) { discard escape buffer ( ) ; state = state . normal ; } else if ( b == __num__ ) { dump escape buffer ( ) ; state = state . after_escape ; add byte to escape buffer ( b ) ; } else { dump escape buffer ( ) ; state = state . normal ; }
10 seconds next job is in 20 seconds : expire the event,assert equals ( __num__ @$ wm . get time to next job ( ) ) ; wm . insert ( new order event ( __str__ @$ __str__ @$ __num__ ) ) ; wm . fire all rules ( ) ; assert equals ( __num__ @$ results . size ( ) ) ; assert equals ( __num__ @$ ( ( number ) results . get ( __num__ ) ) . int value ( ) ) ;
if the number is out of range,s = new scanner ( __str__ ) ; assert false ( s . has next long ( ) ) ; try { s . next long ( ) ; fail ( ) ; } catch ( input mismatch exception expected ) { }
method info.value getter | | method info.value setter,string cast = cast ( method info . return type @$ method info . annotations ) ; if ( index == null && cast . length ( ) > __num__ ) { out . print ( __str__ + cast . substring ( __num__ @$ cast . length ( ) - __num__ ) + __str__ ) ; }
now use the same loader to load class my test,class my test_class = new my diff class loader ( my_test ) . load class ( my_test ) ; try { my test_class . new instance ( ) ; } catch ( exception e ) { throw new runtime exception ( __str__ ) ; }
done building model ; produce a score column with cluster choices,fr2 = kmm . score ( te ) ; assert . assert true ( kmm . test java scoring ( te @$ fr2 @$ __num__ ) ) ; if ( tr != null ) tr . delete ( ) ; if ( te != null ) te . delete ( ) ; if ( fr2 != null ) fr2 . delete ( ) ; if ( fr != null ) fr . delete ( ) ; if ( kmm != null ) kmm . delete ( ) ;
client enqueue close frame should result in a client write failure,final string orig close reason = __str__ ; client socket . get session ( ) . close ( status code . normal @$ orig close reason ) ; assert that ( __str__ @$ client socket . error latch . await ( __num__ @$ seconds ) @$ is ( true ) ) ; assert that ( __str__ @$ client socket . error . get ( ) @$ instance of ( eof exception . class ) ) ;
special case types that have 0 or 1 flag .,switch ( type ) { case type_settings : case type_ping : return flags == flag_ack ? __str__ : binary [ flags ] ; case type_priority : case type_rst_stream : case type_goaway : case type_window_update : return binary [ flags ] ; }
clobber existing entry @$ count remains unchanged,++ mod count ; enqueue notification ( key @$ hash @$ value reference @$ removal cause . replaced ) ; set value ( e @$ key @$ value @$ now ) ; evict entries ( e ) ; return entry value ;
these servers should not appear in the routing table,for ( server instance server instance : routing table . key set ( ) ) { if ( server instance . equals ( helix disabled instance ) || server instance . equals ( shutting down instance ) || server instance . equals ( queries disabled instance ) ) { return false ; } }
retain the scn val every now and then,if ( ctr % _static config . get flush itvl ( ) == __num__ ) { if ( log . is debug enabled ( ) ) { log . debug ( __str__ + ctr ) ; } try { write scn to file ( ) ; } catch ( io exception e ) { log . error ( __str__ + _scn @$ e ) ; throw new databus exception ( __str__ + _scn @$ e ) ; } }
... except the current node if we have content for it,for ( text impl n = first text node in current run ( ) ; n != null ; ) { if ( n == this && content != null && content . length ( ) > __num__ ) { set data ( content ) ; result = this ; n = n . next text node ( ) ; } else { node to remove = n ; n = n . next text node ( ) ; parent . remove child ( to remove ) ; } }
forward again . still have n't reset yet .,m injected current time millis = start_time + interval - __num__ ; assert equals ( __num__ @$ m manager . get remaining call count ( ) ) ; assert equals ( start_time + interval @$ m manager . get rate limit reset time ( ) ) ;
take web.xml from the managed test .,war . set webxml ( fine immutable web failover test case . class . get package ( ) @$ __str__ ) ; war . add as web inf resource ( fine immutable web failover test case . class . get package ( ) @$ __str__ @$ __str__ ) ; return war ;
not using field schema.equals as comments can be different,if ( ! old col . get name ( ) . equals ( new col . get name ( ) ) || ! old col . get type ( ) . equals ( new col . get type ( ) ) ) { return false ; }
its a new entity and has n't been declared .,if ( index == - __num__ ) { if ( fdtd grammar != null ) fdtd grammar . internal entity decl ( name @$ text @$ non normalized text @$ augs ) ; if ( fdtd handler != null ) { fdtd handler . internal entity decl ( name @$ text @$ non normalized text @$ augs ) ; } }
only allocate the new system logger once,if ( result == null ) { logger new logger = new logger ( name @$ resource bundle name @$ null @$ get owner ( ) @$ true ) ; do { if ( add local logger ( new logger ) ) { result = new logger ; } else { result = find logger ( name ) ; } } while ( result == null ) ; }
we were told how big to be,if ( spec mode == measure spec . exactly ) { result = spec size ; } else if ( spec mode == measure spec . at_most ) { result = spec size ; } else { result = canvas size ; }
am 1 is missed from memory rm state store,mem store . remove application attempt internal ( am1 . get application attempt id ( ) ) ; application state data app0 state = mem store . get state ( ) . get application state ( ) . get ( app0 . get application id ( ) ) ; application attempt state data am2 state = app0 state . get attempt ( am2 . get application attempt id ( ) ) ;
reset ticket and wait half of the time left,ticket . reset ( ) ; time . set ( time . get ( ) + full timeout / __num__ ) ; rc = tickets . execute ( ) ; assert that ( rc @$ is ( __num__ ) ) ; assert that ( invoked . get ( ) @$ is ( __num__ ) ) ;
the sidebar fits inside the window @$ do not resize and move,if ( expand resize type == expand resize type . keep_window_size && new window width > get minimum size ( ) . width ) { new window width = get width ( ) ; new windowx = getx ( ) ; }
no ranked routing support and no route given or null session id,ri = new route iterator factory ( single @$ mod_cluster ) . iterator ( __str__ ) ; assert . assert false ( ri . has next ( ) ) ; ri = new route iterator factory ( single @$ mod_cluster ) . iterator ( null ) ; assert . assert false ( ri . has next ( ) ) ;
make sure the target is an instant app .,if ( ! is instant app ( package name @$ user id ) ) { return null ; } synchronized ( m packages ) { return m instant app registry . get instant app android idl pw ( package name @$ user id ) ; }
notify the power manager when ready .,if ( ready && must notify ) { synchronized ( m lock ) { if ( ! m pending request changed locked ) { m display ready locked = true ; if ( debug ) { slog . d ( tag @$ __str__ ) ; } } } send on state changed with wakelock ( ) ; }
next @$ a job failed event is dispatched,event = listener . get events received ( ) . get ( __num__ ) ; assert equals ( activiti event type . job_execution_failure @$ event . get type ( ) ) ; check event context ( event @$ the job ) ;
distribute total radio active time in to this app .,final long app packets = entry . rx packets + entry . tx packets ; final long app radio time = ( radio time * app packets ) / total packets ; u . note mobile radio active time locked ( app radio time ) ;
select a camera if no explicit camera requested,if ( ! explicit request ) { int index = __num__ ; while ( index < num cameras ) { camera . camera info camera info = new camera . camera info ( ) ; camera . get camera info ( index @$ camera info ) ; if ( camera info . facing == camera . camera info . camera_facing_back ) { break ; } index ++ ; } camera id = index ; }
get the number of minimally matching egl configurations,int [ ] num_config = new int [ __num__ ] ; egl . egl choose config ( display @$ s_config attribs2 @$ null @$ __num__ @$ num_config ) ; int num configs = num_config [ __num__ ] ; if ( num configs <= __num__ ) { throw new illegal argument exception ( __str__ ) ; }
