state and commmand converters used by this converter .,this . add state converter ( new integer decimal type converter ( ) ) ; this . add state converter ( new integer percent type converter ( ) ) ; this . add command converter ( new big decimal command converter ( ) ) ; this . add state converter ( new big decimal decimal type converter ( ) ) ; this . add command converter ( new integer command converter ( ) ) ;
move mouse pointer to the center of the fist combo box,point p = cb1 . get location on screen ( ) ; dimension d = cb1 . get size ( ) ; system . out . println ( d . width + __str__ + d . height ) ; robot . mouse move ( p . x + d . width / __num__ @$ p . y + d . height / __num__ ) ;
user task should be active after the timer has triggered,assert that ( cmmn task service . create task query ( ) . case instance id ( case instance . get id ( ) ) . count ( ) ) . is equal to ( __num__ ) ; assert that ( process rule . get task service ( ) . create task query ( ) . process instance id ( process instance . get id ( ) ) . count ( ) ) . is equal to ( __num__ ) ;
adhoc task not part of deployment @$ cleanup,if ( task != null && task . get id ( ) != null ) { task service . delete task ( task . get id ( ) ) ; if ( process engine configuration . get history level ( ) . is at least ( history level . audit ) ) { history service . delete historic task instance ( task . get id ( ) ) ; } }
handle case when min values were larger than necessary,if ( dimension == null ) { int rows = calculate number of rows ( source code words @$ error correction code words @$ min cols ) ; if ( rows < min rows ) { dimension = new int [ ] { min cols @$ min rows } ; } } if ( dimension == null ) { throw new writer exception ( __str__ ) ; } return dimension ;
query on null value @$ should return one value,process instance query query = runtime service . create process instance query ( ) . variable value equals ( __str__ @$ null ) ; list < process instance > process instances = query . list ( ) ; assert not null ( process instances ) ; assert equals ( __num__ @$ process instances . size ( ) ) ; assert equals ( process instance1 . get id ( ) @$ process instances . get ( __num__ ) . get id ( ) ) ;
start puts in region on local site,vm4 . invoke ( ( ) -> wan test base . do puts with key as string ( get test method name ( ) @$ __num__ ) ) ; log writer utils . get log writer ( ) . info ( __str__ ) ;
nested representation is newer than top lever representation .,try { category1_1 = ( category ) s . merge ( category1_1 ) ; fail ( __str__ ) ; } catch ( persistence exception e ) { assert typing ( stale object state exception . class @$ e . get cause ( ) ) ; } finally { tx . rollback ( ) ; s . close ( ) ; }
validation on index usage with queries over a pr,vm0 . invoke ( pr queryd unit helper . get cache serializable runnable for index usage check ( ) ) ; vm1 . invoke ( pr queryd unit helper . get cache serializable runnable for index usage check ( ) ) ; vm2 . invoke ( pr queryd unit helper . get cache serializable runnable for index usage check ( ) ) ; vm3 . invoke ( pr queryd unit helper . get cache serializable runnable for index usage check ( ) ) ;
found a candidate . just use this .,if ( ! bounds conflict ( task bounds to check @$ m tmp bounds ) && display bounds . contains ( m tmp bounds ) ) { in out bounds . set ( m tmp bounds ) ; if ( debug ) append log ( __str__ + in out bounds ) ; return ; }
exception thrown and handled before any async processing,if ( in wait ) { response = execute request ( http version ) ; } else { try ( stackless logging log = new stackless logging ( http channel state . class ) ) { response = execute request ( http version ) ; } }
initialize the task by initializing all its processor nodes in the topology,log . trace ( __str__ ) ; for ( final processor node node : topology . processors ( ) ) { processor context . set current node ( node ) ; try { node . init ( processor context ) ; } finally { processor context . set current node ( null ) ; } }
add a shutdown hook to remove the temp file .,if ( t == null ) { access controller . do privileged ( ( privileged action < void > ) ( ) -> { thread group roottg = thread group utils . get root thread group ( ) ; t = new thread ( roottg @$ temp file deletion hook :: run hooks ) ; t . set context class loader ( null ) ; runtime . get runtime ( ) . add shutdown hook ( t ) ; return null ; } ) ; }
force properties to be clean as well,configuration manager . get config instance ( ) . clear ( ) ; hystrix command key key = hystrix . get current thread executing command ( ) ; if ( key != null ) { system . out . println ( __str__ + key + __str__ ) ; }
exact match for resources matched to the root path,routes . produce ( new route build item ( standalone . deployment root path @$ handler @$ false ) ) ; string match path = standalone . deployment root path ; if ( match path . ends with ( __str__ ) ) { match path += __str__ ; } else { match path += __str__ ; }
out of range for whole batch .,if ( use min max && ( key < min || key > max ) ) { join result = join util . join result . nomatch ; } else { join result = hash set . contains ( key @$ hash set results [ __num__ ] ) ; }
ensure second shift selection added instead of moved,assert equals ( __str__ @$ get logs ( ) . get ( __num__ ) ) ; selected = select . get all selected options ( ) ; assert equals ( __num__ @$ selected . size ( ) ) ; assert equals ( __str__ @$ selected . get ( __num__ ) . get text ( ) ) ; assert equals ( __str__ @$ selected . get ( __num__ ) . get text ( ) ) ;
allocate space for all configs and ask again .,egl config [ ] configs = new egl config [ num configs [ __num__ ] ] ; if ( ! egl . egl get configs ( display @$ configs @$ num configs [ __num__ ] @$ num configs ) ) { get err print writer ( ) . println ( __str__ ) ; return gl extensions ; }
load invoice @$ invoice lines should not be loaded,invoice invoice = session . get ( invoice . class @$ _invoice . get id ( ) ) ; assert . assert equals ( __str__ + __str__ @$ __num__ @$ stats . get entity count ( ) ) ; receipt receipt = new receipt ( receipt_a ) ; receipt . set invoice ( invoice ) ; session . persist ( receipt ) ; return invoice ;
only add the ship the folder @$ not the contents,assert . assert false ( effective ship files . contains ( lib file ) ) ; assert . assert true ( effective ship files . contains ( lib folder ) ) ; assert . assert false ( descriptor . get ship files ( ) . contains ( lib file ) ) ; assert . assert false ( descriptor . get ship files ( ) . contains ( lib folder ) ) ;
check that we 're not inside a deep learning task 2,assert ( ( ! dlp . _replicate_training_data || h2o . cloud . size ( ) == __num__ ) == ! _run_local ) ; if ( ! _run_local ) { _localmodel . add_processed_global ( _localmodel . get_processed_local ( ) ) ; _localmodel . set_processed_local ( __num__ ) ; if ( _chunk_node_count > __num__ ) _localmodel . div ( _chunk_node_count ) ; if ( _localmodel . get_params ( ) . _elastic_averaging ) _sharedmodel = deep learning model info . time average ( _localmodel ) ; } else { _sharedmodel = _localmodel ; }
release the partition if it was successfully removed,if ( partition == previous ) { partition . release ( ) ; result partitionid partition id = partition . get partition id ( ) ; log . debug ( __str__ @$ partition id . get partition id ( ) @$ partition id . get producer id ( ) ) ; }
artifact 2 is a tree artifact generated by action template .,special artifact artifact2 = create derived tree artifact only ( __str__ ) ; create fake tree file artifact ( artifact2 @$ __str__ @$ __str__ ) ; create fake tree file artifact ( artifact2 @$ __str__ @$ __str__ ) ; actions . add ( actions test util . create dummy spawn action template ( artifact1 @$ artifact2 ) ) ;
creating a duplicate index @$ should throw a index exists exception,vm1 . invoke ( pr queryd unit helper . get cache serializable runnable for duplicatepr index create ( partitioned_region_name @$ __str__ @$ __str__ @$ null @$ __str__ ) ) ; vm2 . invoke ( pr queryd unit helper . get cache serializable runnable for duplicatepr index create ( partitioned_region_name @$ __str__ @$ __str__ @$ null @$ __str__ ) ) ; vm3 . invoke ( pr queryd unit helper . get cache serializable runnable for duplicatepr index create ( partitioned_region_name @$ __str__ @$ __str__ @$ null @$ __str__ ) ) ;
make sure both are still traversed .,method = mock classc . class . get method ( __str__ ) ; ann = skylark interface utils . get skylark callable ( method ) ; assert that ( ann ) . is not null ( ) ; assert that ( ann . doc ( ) ) . is equal to ( __str__ ) ;
load nss softoken dependencies in advance to avoid resolver issues,safe reload ( libdir + system . map library name ( nspr_prefix + __str__ ) ) ; safe reload ( libdir + system . map library name ( nspr_prefix + __str__ ) ) ; safe reload ( libdir + system . map library name ( nspr_prefix + __str__ ) ) ; safe reload ( libdir + system . map library name ( __str__ ) ) ; safe reload ( libdir + system . map library name ( __str__ ) ) ; return true ;
parse ciphers in challenge ; mark each that server supports,for ( int i = __num__ ; i < token count ; i ++ ) { token = parser . next token ( ) ; for ( int j = __num__ ; j < cipher_tokens . length ; j ++ ) { if ( token . equals ( cipher_tokens [ j ] ) ) { server ciphers [ j ] |= cipher_masks [ j ] ; server cipher strs [ j ] = token ; logger . log ( level . fine @$ __str__ @$ token ) ; } } }
continue ramping up if the target rate has not been reached yet,if ( next target rate != target rate ) { _scheduler . schedule ( ( ) -> set rate and ramp up ( transaction id @$ target permits per period @$ period milliseconds @$ burst @$ ramp up permits per seconds ) @$ one_second_in_ms @$ time unit . milliseconds ) ; }
completion of txnid : id txn update 2,write id = txn mgr . get table write id ( __str__ @$ __str__ ) ; adp = new add dynamic partitions ( txn mgr . get current txn id ( ) @$ write id @$ __str__ @$ __str__ @$ collections . singleton list ( __str__ ) ) ; adp . set operation type ( data operation type . delete ) ; txn handler . add dynamic partitions ( adp ) ; txn mgr . commit txn ( ) ;
we must never reject on because of thread pool capacity on replicas,transport service . register request handler ( transport replica action @$ in -> new concrete replica request < > ( in @$ replica request reader ) @$ executor @$ true @$ true @$ new replica operation transport handler ( ) ) ;
change the setting and assert a successful change .,try { set setting via front end api and assert successful change ( type @$ fake_setting_name @$ fake_setting_value @$ user id ) ; } finally { set string via front end api setting ( type @$ fake_setting_name @$ null @$ user id ) ; }
write the stack variable length @$ not the datatype length,attrs . add attribute ( __str__ @$ var . get length ( ) @$ true ) ; string comment = var . get comment ( ) ; if ( comment == null || comment . length ( ) == __num__ ) { writer . write element ( __str__ @$ attrs ) ; } else { writer . start element ( __str__ @$ attrs ) ; write regular comment ( writer @$ comment ) ; writer . end element ( __str__ ) ; }
verify that batching of the ib rs occurred .,metrics record builder rb = get metrics ( __str__ ) ; long batched = metrics asserts . get long counter ( __str__ @$ rb ) ; assert true ( batched > __num__ ) ; if ( cluster != null ) { cluster . shutdown ( ) ; }
scheduled should be chosen to run next,wait for query state ( query runner @$ scheduled5 @$ running ) ; cancel query ( query runner @$ backfill2 ) ; cancel query ( query runner @$ backfill3 ) ; cancel query ( query runner @$ backfill4 ) ; cancel query ( query runner @$ scheduled5 ) ; wait for query state ( query runner @$ scheduled5 @$ failed ) ;
create a name space with x attributes,path dir = new path ( __str__ ) ; hdfs . mkdirs ( dir ) ; hdfs . setx attr ( dir @$ __str__ @$ __str__ . get bytes ( ) ) ; hdfs . setx attr ( dir @$ __str__ @$ __str__ . get bytes ( ) ) ;
try to spread out the scheduling when starting up,synchronized ( m_poll queue ) { int n = m_poll queue . size ( ) ; long poll delay = n * d . get poll interval ( ) / ( a num dev > __num__ ? a num dev : __num__ ) ; add to poll queue ( d @$ system . current time millis ( ) + poll delay ) ; m_poll queue . notify ( ) ; }
also clear temporary lost component stored in window,if ( window != null ) { window real window = ( window ) window ; if ( real window . get temporary lost component ( ) == comp ) { real window . set temporary lost component ( null ) ; } }
keep the write for using it in visit,this . writer = writer ; store scan < io exception > scan = index store view . visit nodes ( array utils . empty_int_array @$ always_true_int @$ null @$ this @$ true ) ; scan . run ( ) ; return count ;
insert the new entry into the db .,try ( sq lite database db = helper . get writable database ( ) ) { db . insert ( db helper . table_name @$ db helper . timestamp_col @$ values ) ; } catch ( sql exception sqle ) { log . w ( tag @$ sqle ) ; }
send events to ensure state is updated,if ( event . get focused cell ( ) . get column ( ) == selection column . this ) { select all check box . set value ( ! select all check box . get value ( ) @$ true ) ; }
only retry on a subset of service exceptions,if ( exception instanceof amazon service exception ) { amazon service exception ase = ( amazon service exception ) exception ; if ( retry utils . is retryable service exception ( ase ) ) return true ; if ( retry utils . is throttling exception ( ase ) ) return true ; if ( retry utils . is clock skew error ( ase ) ) return true ; }
check if char is same as any other symbol,if ( ch == symbols . get decimal separator ( ) || ch == symbols . get grouping separator ( ) ) { buffer . append ( quote ) ; buffer . append ( ch ) ; buffer . append ( quote ) ; } else { buffer . append ( ch ) ; }
explicit check required in case table is empty .,final int expected mod count = mod count ; hashtable entry < ? @$ ? > [ ] tab = table ; for ( hashtable entry < ? @$ ? > entry : tab ) { while ( entry != null ) { action . accept ( ( k ) entry . key @$ ( v ) entry . value ) ; entry = entry . next ; if ( expected mod count != mod count ) { throw new concurrent modification exception ( ) ; } } }
wait for apps to be processed by mock preemption thread,for ( int i = __num__ ; i < __num__ ; ++ i ) { if ( preemption thread . unique apps added ( ) >= __num__ ) { break ; } thread . sleep ( __num__ ) ; } assert not null ( __str__ @$ scheduler . get context ( ) . get starved apps ( ) ) ; assert equals ( __str__ + __str__ @$ __num__ @$ preemption thread . unique apps added ( ) ) ;
when app is already installed @$ prefer same medium,if ( params . install location == package info . install_location_auto ) { if ( existing info != null ) { if ( ( existing info . flags & application info . flag_external_storage ) != __num__ ) { prefer = recommend_install_external ; } else { prefer = recommend_install_internal ; } } else { prefer = recommend_install_internal ; } check both = true ; } else { prefer = recommend_install_internal ; check both = false ; }
can handle 0 length streams gracefully .,url empty txt url = get class ( ) . get resource ( __str__ ) ; if ( empty txt url == null ) { throw new runtime exception ( __str__ ) ; } input stream empty stream = new buffered input stream ( empty txt url . open stream ( ) ) ; int length = archive helper . get bytes from input stream ( empty stream ) . length ; assert equals ( length @$ __num__ ) ; empty stream . close ( ) ;
the node is the root @$ release the kraken !,final hep planner tmp planner = new hep planner ( program ) ; tmp planner . set root ( node ) ; node = tmp planner . find best exp ( ) ; final hive rel field trimmer field trimmer = new hive rel field trimmer ( null @$ rel builder factory . create ( node . get cluster ( ) @$ null ) @$ fetch stats ) ; call . transform to ( field trimmer . trim ( node ) ) ; triggered = true ;
a standard transaction as wallets would create,transaction tx = fake tx builder . create fake tx ( unittest ) ; assert false ( tx . is opt in fullrbf ( ) ) ; tx . get inputs ( ) . get ( __num__ ) . set sequence number ( transaction input . no_sequence - __num__ ) ; assert true ( tx . is opt in fullrbf ( ) ) ;
setup the producer and send the message .,stub connection connection = create connection ( ) ; connection info connection info = create connection info ( ) ; connection info . set client id ( __str__ ) ; session info session info = create session info ( connection info ) ; producer info producer info = create producer info ( session info ) ; connection . send ( connection info ) ; connection . send ( session info ) ; connection . send ( producer info ) ;
type common to all declarations in the same statement,java type definition base type = node . get type node ( ) . get type definition ( ) ; if ( base type != null ) { node . set type definition ( base type . with dimensions ( node . get array depth ( ) ) ) ; }
there is a valid bucket pruning filter,if ( bs . cardinality ( ) < num buckets ) { top . get conf ( ) . set included buckets ( bs ) ; top . get conf ( ) . set num buckets ( num buckets ) ; }
check consistency : canonical classes must be from 0 to 255,int cc = integer . parse int ( line . substring ( start @$ end ) ) ; if ( cc != ( cc & __num__ ) ) system . err . println ( __str__ + line ) ; canonical class . put ( value @$ cc ) ; end = line . index of ( __str__ @$ start = end + __num__ ) ;
... and let them know of the event,jingle session request request = new jingle session request ( this @$ init jin ) ; for ( int i = __num__ ; i < jingle session request listeners . length ; i ++ ) { jingle session request listeners [ i ] . session requested ( request ) ; }
read savable array and convert to map values,if ( value instanceof intid map ) { intid map in = ( intid map ) value ; savable [ ] values = resolvei ds ( in . values ) ; value = int savable map fromkv ( in . keys @$ values ) ; field data . put ( field . alias @$ value ) ; }
need to override passed in class if class is lambda .,try { cls = class . for name ( cls name @$ true @$ cls ldr ) ; } catch ( class not found exception e ) { throw new ignite checked exception ( __str__ + cls name @$ e ) ; }
treat return types as object for the purposes of this method .,if ( super bt == type . bt_addr ) { supertype = type . object ; super bt = type . bt_object ; } if ( sub bt == type . bt_addr ) { subtype = type . object ; sub bt = type . bt_object ; } if ( ( super bt != type . bt_object ) || ( sub bt != type . bt_object ) ) { return supertype . is intlike ( ) && subtype . is intlike ( ) ; }
seek to the first kv on this row,if ( this . is seek to row ) { should scan keys values = ( scanner . seek to ( private cell util . create first on row ( this . row ) ) != - __num__ ) ; } else { should scan keys values = scanner . seek to ( ) ; }
find the number of the last cleanup,for ( cleanup remote file cleanup remote file : cleanup files . values ( ) ) { cleanup number = math . max ( cleanup number @$ cleanup remote file . get cleanup number ( ) ) ; } return cleanup number ;
no c because it is too large to fit,assert . assert equals ( result list . get ( __num__ ) . get string ( ) @$ __str__ ) ; assert . assert equals ( result list . get ( __num__ ) . get string ( ) @$ __str__ ) ;
verify if token has been updated in ugi .,tokens = new array list < > ( ugi . get tokens ( ) ) ; assert equals ( __num__ @$ tokens . size ( ) ) ; assert equals ( timeline delegation token identifier . kind_name @$ tokens . get ( __num__ ) . get kind ( ) ) ; assert equals ( collector token . decode identifier ( ) @$ tokens . get ( __num__ ) . decode identifier ( ) ) ;
gather the setter 's details but only the ones we need,if ( setter != null ) { if ( param type == null ) { param type = setter . get parameter type ( __num__ ) ; } for ( final annotation field annotation : setter . annotations ( ) ) { if ( ! param annotations . contains ( field annotation ) ) { param annotations . add ( field annotation ) ; } } }
do n't want this to happen ...,if ( on insert row == true ) { throw new sql exception ( res bundle . handle get object ( __str__ ) . to string ( ) ) ; } row current row = ( row ) get current row ( ) ; if ( current row . get updated ( ) == true ) { current row . clear updated ( ) ; notify row changed ( ) ; }
add the server to gray server list,if ( need put to gray servers ( get failed event . get failed type ( ) ) ) { add to gray list ( new ps location ( request . get context ( ) . get actual server id ( ) @$ request . get context ( ) . get location ( ) ) ) ; } get data split ( ) ; break ;
copy the bytes from this piece .,int current piece remaining = current piece size - current piece index ; int count = math . min ( current piece remaining @$ bytes remaining ) ; if ( b != null ) { current piece . copy to ( b @$ current piece index @$ offset @$ count ) ; offset += count ; } current piece index += count ; bytes remaining -= count ;
convert a deprecated language code used by java to a new code,if ( language . length ( ) > __num__ && is language ( language ) ) { if ( language . equals ( __str__ ) ) { language = __str__ ; } else if ( language . equals ( __str__ ) ) { language = __str__ ; } else if ( language . equals ( __str__ ) ) { language = __str__ ; } tag . _language = language ; }
now do the actual status notification testing,contact presence event collector contact pres evt collector = new contact presence event collector ( fixture . userid2 @$ new status ) ; operation set presence1 . add contact presence status listener ( contact pres evt collector ) ; synchronized ( contact pres evt collector ) { operation set presence2 . publish presence status ( new status @$ __str__ ) ; contact pres evt collector . wait for event ( __num__ ) ; operation set presence1 . remove contact presence status listener ( contact pres evt collector ) ; }
move this region to the master regionserver,region plan plan = new region plan ( region @$ server . get key ( ) @$ master server name ) ; if ( plans == null ) { plans = new array list < > ( ) ; } plans . add ( plan ) ;
eintr not listed as a possible error,if ( stdlib . realpath ( path @$ resolved ) . is null ( ) ) { throw throw unix exception ( errno ( ) ) ; } else { result = to byte array ( resolved ) ; } return result ;
without width attribute caption will not render on the web,caption attributes . set value ( attr_dimen_width @$ meta data . get width ( ) ) ; caption extensions kt . set image caption ( m content @$ m tapped media predicate @$ meta data . get caption ( ) @$ caption attributes ) ;
compare rows . cache row length .,int left row length = left . get row length ( ) ; int right row length = right . get row length ( ) ; int diff = byte buffer utils . compare to ( left . get row byte buffer ( ) @$ left . get row position ( ) @$ left row length @$ right . get row byte buffer ( ) @$ right . get row position ( ) @$ right row length ) ; if ( diff != __num__ ) { return diff ; }
spill all elements gathered up to now,num buffers spilled += full buffers . size ( ) ; while ( full buffers . size ( ) > __num__ ) { current writer . write block ( full buffers . remove first ( ) ) ; } current writer . write block ( current ) ; num buffers spilled ++ ;
1 should be replace by 0 .,logger . debug ( __str__ @$ window range ) ; assert . assert equals ( window range . get from ( ) @$ __num__ ) ; assert . assert equals ( window range . get to ( ) @$ time unit . minutes . to millis ( __num__ ) ) ;
verify get keys can relogin with proxy user,user group information another ugi = user group information . create proxy user ( __str__ @$ client ugi ) ; another ugi . do as ( new privileged exception action < void > ( ) { @ override public void run ( ) throws exception { thread . sleep ( __num__ ) ; key provider kp = create provider ( uri @$ conf ) ; kp . get keys ( ) ; return null ; } } ) ; return null ;
find setter method for the given property name .,string setter name = __str__ + capitalize ( name ) ; method setter = null ; for ( method method : type . get methods ( ) ) { if ( method . get name ( ) . equals ( setter name ) ) { setter = method ; break ; } } if ( setter == null ) { sourced . add error ( __str__ @$ type . get name ( ) @$ setter name ) ; return ; }
ask for versions that do not exist .,kvs = getn versions ( ht @$ cf @$ row idx @$ col idx @$ arrays . as list ( __num__ @$ __num__ ) ) ; assert equals ( __num__ @$ kvs == null ? __num__ : kvs . length ) ;
traverse virtual edges and normal edges but no shortcuts !,assert equals ( gh utility . as set ( from res . get closest node ( ) ) @$ gh utility . get neighbors ( explorer . set base node ( __num__ ) ) ) ; assert equals ( gh utility . as set ( to res . get closest node ( ) @$ __num__ ) @$ gh utility . get neighbors ( explorer . set base node ( __num__ ) ) ) ;
now add our own session id to the new record,secure random sr = new secure random ( ) ; byte [ ] sess id = new byte [ new sess id len ] ; sr . next bytes ( sess id ) ; new record . put ( ( byte ) new sess id len ) ; new record . put ( sess id ) ;
should match @$ port in range and host the same,assert true ( hostname port with range . matches ( uri . create ( __str__ + host1 + __str__ ) ) ) ; assert true ( hostname port with range . matches ( uri . create ( __str__ + host1 + __str__ ) ) ) ; assert true ( hostname port with range . matches ( uri . create ( __str__ + host1 + __str__ ) ) ) ;
shutdown if no request in 10 seconds .,try { ss . set so timeout ( __num__ ) ; for ( ; ; ) { socket s = ss . accept ( ) ; ( new worker ( s ) ) . start ( ) ; } } catch ( exception e ) { }
bottom left and top right corner points relative to origin,final float world originx = x + originx ; final float world originy = y + originy ; float fx = - originx ; float fy = - originy ; float fx2 = width - originx ; float fy2 = height - originy ;
